<?xml version="1.0" encoding="UTF-8"?>
<!DOCTYPE musicos [
    <!ELEMENT musicos (musico*)>
    <!ELEMENT musico (nombre, apodo?, fechaNacimiento)>
    <!ELEMENT nombre (#PCDATA)>
    <!ELEMENT apodo (#PCDATA)>
    <!ELEMENT fechaNacimiento (#PCDATA)>
]>
<!-- Dado el siguiente documento XML, aÃ±ade el DTD necesario para que valide. -->
<musicos>
    <musico>
        <nombre>Antonio Vivaldi</nombre>
        <apodo>El cura pelirrojillo</apodo>
        <fechaNacimiento>4 de marzo de 1678</fechaNacimiento>
    </musico>
    <musico>
        <nombre>Johann Sebastian Bach</nombre>
        <fechaNacimiento>21 de marzo de 1685</fechaNacimiento>
    </musico>
</musicos>